{
  "headings": {
    "sections": "TL;DR",
    "suggestedVideos": "Suggested",
    "links": "Links",
    "credits": "Credits",
    "affiliateLinks": "Affiliate links",
    "footnotes": "Change log",
    "support": "Support"
  },
  "separator": "ðŸ‘‰",
  "affiliateLinks": {
    "amazon": {
      "brotherPrinter": {
        "label": "Brother HL-L2370DW printer",
        "url": [
          {
            "label": "USA",
            "url": "https://www.amazon.com/dp/B076Q1FK19?tag=sunknudsen06-20"
          }
        ]
      }
    }
  },
  "videos": [
    {
      "id": "YrUSJQq8WOA",
      "publishedAt": "2022-11-03T14:43:45Z",
      "title": "macOS stores a copy of everything one prints forever",
      "description": "In this episode, we explore how macOS stores a copy of everything one prints forever.",
      "tags": ["Privacy", "Security", "macOS"],
      "categoryId": "27",
      "sections": [],
      "suggestedVideos": [],
      "links": [
        {
          "label": "How to disable CUPS pinter job history on macOS",
          "url": "https://sunknudsen.com/privacy-guides/how-to-disable-cups-pinter-job-history-on-macos"
        },
        {
          "label": "Twitter (please follow @superbacked)",
          "url": "https://twitter.com/superbacked"
        },
        {
          "label": "Superbacked (join waiting list)",
          "url": "https://superbacked.com/"
        }
      ],
      "credits": [],
      "affiliateLinks": ["amazon.brotherPrinter"],
      "footnotes": [],
      "support": [
        {
          "label": "Support my research",
          "url": "https://sunknudsen.com/donate"
        }
      ],
      "thumbnailHash": "65c65f74ac181dcffc994d9f75ed88392bdcc434165bc59dda2a0553a0725ac6"
    }
  ]
}
